https://www.amazon.it/dp/B09CGSCBK5;379.99;529;De'Longhi Magnifica Evo Perfetto, Macchina Automatica per Caffè in Chicchi
https://www.amazon.it/dp/B0BGSRV33C;349.00;518.9;Cecotec Robot da cucina multifunzione Mambo Touch con brocca Avana. 1600 W
https://www.amazon.it/dp/B005S42GG4;110.72;199;illy Macchina da Caffè a Capsule Iperespresso X7.1, Bianco
https://www.amazon.it/dp/B0B8HY28B3;79.00;99.99;Nespresso Vertuo Pop XN9205K, Macchina caffè di Krups
https://www.amazon.it/dp/B06XSNYBRF;116.19;548.75;Laica VT3120 Macchina Sottovuoto per Alimenti, Automatica
https://www.amazon.it/dp/B09TRV4VCC;109.99;129.99;Princess Friggitrice ad Aria XXXL, 1800 watt, 6.5 litri